{
  "context": {
    "operationId": "11111111-1111-4111-8111-111111111111",
    "operationType": "requirements-extraction",
    "contractVersion": "1.0",
    "workspaceId": "22222222-2222-4222-8222-222222222222",
    "assessment": {
      "assessmentId": "44444444-4444-4444-8444-444444444444",
      "basedOnVersion": 7
    }
  },
  "proposal": {
    "requirements": [
      {
        "clientReference": "req-scim",
        "category": "provisioning",
        "statement": "The selected architecture must support SCIM provisioning.",
        "sourceExcerpt": "SCIM provisioning is mandatory",
        "criticalityProposal": {
          "value": "REQUIRED",
          "rationale": "The source explicitly marks SCIM as mandatory."
        }
      }
    ],
    "clarifyingQuestions": [
      {
        "questionId": "q-admin-sso",
        "prompt": "Which workforce identity provider authenticates administrators?",
        "reason": "The source requires administrator SSO but does not identify the upstream provider."
      }
    ],
    "warnings": [],
    "requiresHumanAcceptance": true
  },
  "confidence": "high",
  "evidenceReferences": [
    {
      "referenceId": "source-1",
      "kind": "input-span",
      "locator": "input.sourceText:0-30"
    }
  ],
  "toolInvocations": [
    {
      "toolName": "assessment.requirements.read",
      "outcome": "succeeded"
    }
  ]
}
